{
  "schemaVersion": "1.0",
  "id": "skl_01JB3Z7Q8K4M2N6P9R5T1V0W3X",
  "slug": "maa-masala-chai",
  "version": "1.0.0",
  "title": {
    "hi": "माँ की मसाला चाय",
    "en": "Maa's masala chai"
  },
  "summary": {
    "hi": "अदरक-इलायची वाली कड़क चाय, माँ के तरीके से।",
    "en": "Strong ginger-cardamom chai, made the way Maa makes it."
  },
  "languages": {
    "authored": "hi",
    "available": [
      "hi",
      "en"
    ]
  },
  "author": {
    "displayName": "Maa",
    "role": "expert"
  },
  "consent": {
    "recordedAt": "2026-10-18T09:12:00+05:30",
    "scopes": [
      "derive-skill",
      "store-recording",
      "share-with-invited",
      "use-for-evaluation"
    ],
    "policyVersion": "2026-10",
    "retainRecordingUntil": "2026-11-17"
  },
  "safety": {
    "category": "cooking",
    "hazardTags": [
      "hot-surface",
      "open-flame"
    ],
    "reviewStatus": "approved"
  },
  "estimatedDurationSec": 600,
  "perception": {
    "embeddingModel": {
      "id": "facebook/dinov2-small",
      "revision": "executorch-xnnpack-fp16-v1",
      "dim": 384,
      "preprocess": "resize-256-center-crop-224-imagenet-norm"
    },
    "learnProfile": "medium-7fps",
    "workZone": {
      "pitchMinDeg": -72,
      "pitchMaxDeg": -18
    },
    "thresholds": {
      "low": 0.45,
      "high": 0.7,
      "autoAccept": 0.9,
      "consecutive": 3
    }
  },
  "privacy": {
    "keepReferenceImages": false,
    "bystanderFacesBlurred": true
  },
  "materials": [
    {
      "id": "mat-water",
      "name": {
        "hi": "पानी",
        "en": "Water"
      },
      "quantity": {
        "hi": "1 कप",
        "en": "1 cup"
      }
    },
    {
      "id": "mat-ginger",
      "name": {
        "hi": "अदरक",
        "en": "Ginger"
      },
      "quantity": {
        "hi": "1 इंच का टुकड़ा",
        "en": "1-inch piece"
      }
    },
    {
      "id": "mat-cardamom",
      "name": {
        "hi": "इलायची",
        "en": "Green cardamom"
      },
      "quantity": {
        "hi": "2",
        "en": "2 pods"
      }
    },
    {
      "id": "mat-tea",
      "name": {
        "hi": "चाय पत्ती",
        "en": "Loose tea leaves"
      },
      "quantity": {
        "hi": "डेढ़ चम्मच",
        "en": "1½ teaspoons"
      }
    },
    {
      "id": "mat-milk",
      "name": {
        "hi": "दूध",
        "en": "Milk"
      },
      "quantity": {
        "hi": "1 कप",
        "en": "1 cup"
      }
    },
    {
      "id": "mat-sugar",
      "name": {
        "hi": "चीनी",
        "en": "Sugar"
      },
      "quantity": {
        "hi": "स्वाद अनुसार",
        "en": "To taste"
      }
    }
  ],
  "steps": [
    {
      "id": "s1-water",
      "title": {
        "hi": "पानी",
        "en": "Water"
      },
      "instruction": {
        "text": {
          "hi": "पैन में एक कप पानी डालो और गैस पर रखो।",
          "en": "Pour one cup of water into the pan and put it on the stove."
        },
        "clip": "clip-s1"
      },
      "dependsOn": [],
      "completion": {
        "policy": "all",
        "signals": [
          {
            "type": "visual",
            "criteria": "A pan containing water sits on a lit gas burner."
          }
        ]
      },
      "references": {
        "before": [
          "emb-s1-before"
        ],
        "during": [
          "emb-s1-during"
        ],
        "after": [
          "emb-s1-after"
        ]
      },
      "calibration": {
        "a": 8.4,
        "b": -3.1
      },
      "expectedDurationSec": {
        "p50": 25,
        "p90": 60
      },
      "materials": [
        "mat-water"
      ],
      "sourceSpanMs": {
        "startMs": 0,
        "endMs": 31000
      }
    },
    {
      "id": "s2-ginger",
      "title": {
        "hi": "अदरक",
        "en": "Ginger"
      },
      "instruction": {
        "text": {
          "hi": "अदरक को कूटकर पानी में डालो।",
          "en": "Crush the ginger and add it to the water."
        },
        "clip": "clip-s2"
      },
      "dependsOn": [
        "s1-water"
      ],
      "completion": {
        "policy": "all",
        "signals": [
          {
            "type": "visual",
            "criteria": "Crushed ginger pieces are floating in the water in the pan."
          }
        ]
      },
      "references": {
        "before": [
          "emb-s2-before"
        ],
        "during": [
          "emb-s2-during"
        ],
        "after": [
          "emb-s2-after"
        ]
      },
      "calibration": {
        "a": 9.0,
        "b": -2.8
      },
      "expectedDurationSec": {
        "p50": 40,
        "p90": 90
      },
      "hints": [
        {
          "trigger": "on_stuck",
          "afterSec": 90,
          "message": {
            "text": {
              "hi": "खल-मूसल में कूट लो।",
              "en": "Crush it in the mortar and pestle."
            },
            "clip": "clip-h-s2-stuck"
          }
        }
      ],
      "materials": [
        "mat-ginger"
      ],
      "sourceSpanMs": {
        "startMs": 31000,
        "endMs": 78000
      }
    },
    {
      "id": "s3-cardamom",
      "title": {
        "hi": "इलायची",
        "en": "Cardamom"
      },
      "instruction": {
        "text": {
          "hi": "दो इलायची कूटकर डाल दो।",
          "en": "Crush two cardamom pods and add them."
        },
        "clip": "clip-s3"
      },
      "dependsOn": [
        "s1-water"
      ],
      "completion": {
        "policy": "all",
        "signals": [
          {
            "type": "visual",
            "criteria": "Cracked green cardamom pods are in the water in the pan."
          }
        ]
      },
      "references": {
        "before": [
          "emb-s3-before"
        ],
        "during": [
          "emb-s3-during"
        ],
        "after": [
          "emb-s3-after"
        ]
      },
      "calibration": {
        "a": 7.6,
        "b": -2.2
      },
      "expectedDurationSec": {
        "p50": 20,
        "p90": 50
      },
      "materials": [
        "mat-cardamom"
      ],
      "sourceSpanMs": {
        "startMs": 78000,
        "endMs": 101000
      }
    },
    {
      "id": "s4-boil",
      "title": {
        "hi": "उबाल",
        "en": "Boil"
      },
      "instruction": {
        "text": {
          "hi": "दो मिनट तक उबलने दो।",
          "en": "Let it boil for two minutes."
        },
        "clip": "clip-s4"
      },
      "dependsOn": [
        "s2-ginger",
        "s3-cardamom"
      ],
      "completion": {
        "policy": "all",
        "signals": [
          {
            "type": "timer",
            "seconds": 120,
            "announce": true
          },
          {
            "type": "visual",
            "criteria": "The water is at a rolling boil and has turned pale yellow."
          }
        ]
      },
      "references": {
        "before": [
          "emb-s4-before"
        ],
        "during": [
          "emb-s4-during"
        ],
        "after": [
          "emb-s4-after"
        ]
      },
      "calibration": {
        "a": 6.9,
        "b": -1.9
      },
      "expectedDurationSec": {
        "p50": 130,
        "p90": 200
      },
      "hints": [
        {
          "trigger": "on_enter",
          "message": {
            "text": {
              "hi": "आँच मध्यम रखो।",
              "en": "Keep the flame at medium."
            },
            "clip": "clip-h-s4-enter"
          }
        }
      ],
      "sourceSpanMs": {
        "startMs": 101000,
        "endMs": 236000
      }
    },
    {
      "id": "s5-tea",
      "title": {
        "hi": "चाय पत्ती",
        "en": "Tea leaves"
      },
      "instruction": {
        "text": {
          "hi": "अब डेढ़ चम्मच चाय पत्ती डालो।",
          "en": "Now add one and a half teaspoons of tea leaves."
        },
        "clip": "clip-s5"
      },
      "dependsOn": [
        "s4-boil"
      ],
      "completion": {
        "policy": "all",
        "signals": [
          {
            "type": "visual",
            "criteria": "Loose black tea leaves are in the boiling water, which is turning dark brown."
          }
        ]
      },
      "references": {
        "before": [
          "emb-s5-before"
        ],
        "after": [
          "emb-s5-after"
        ]
      },
      "calibration": {
        "a": 9.2,
        "b": -2.6
      },
      "expectedDurationSec": {
        "p50": 15,
        "p90": 40
      },
      "mistakes": [
        {
          "id": "m-tea-before-ginger",
          "kind": "order",
          "requires": [
            "s2-ginger",
            "s4-boil"
          ],
          "message": {
            "text": {
              "hi": "रुको — पत्ती से पहले अदरक डालो, नहीं तो अदरक का स्वाद नहीं आएगा।",
              "en": "Wait — add the ginger before the tea leaves, or you won't taste the ginger."
            },
            "clip": "clip-m-tea-before-ginger"
          },
          "severity": "warn",
          "source": "expert"
        }
      ],
      "materials": [
        "mat-tea"
      ],
      "sourceSpanMs": {
        "startMs": 236000,
        "endMs": 262000
      }
    },
    {
      "id": "s6-milk",
      "title": {
        "hi": "दूध",
        "en": "Milk"
      },
      "instruction": {
        "text": {
          "hi": "एक कप दूध डालो।",
          "en": "Add one cup of milk."
        },
        "clip": "clip-s6"
      },
      "dependsOn": [
        "s5-tea"
      ],
      "completion": {
        "policy": "all",
        "signals": [
          {
            "type": "visual",
            "criteria": "Milk has been added; the liquid in the pan is a light tan colour."
          }
        ]
      },
      "references": {
        "before": [
          "emb-s6-before"
        ],
        "during": [
          "emb-s6-during"
        ],
        "after": [
          "emb-s6-after"
        ]
      },
      "calibration": {
        "a": 5.8,
        "b": -1.4
      },
      "expectedDurationSec": {
        "p50": 15,
        "p90": 40
      },
      "materials": [